connector_id,connector_name,platform,keyword,pull_time,video_id,video_title,video_description,video_url,channel_id,channel_name,published_at,view_count,like_count,favorite_count,comment_count,thumbnail_url,clean_video_title,title_word_count,title_char_count,clean_video_description,description_word_count,description_char_count,sentiment_score,sentiment_label,video_age_days,video_age_hours,view_count_numeric,like_count_numeric,favorite_count_numeric,comment_count_numeric,hashtags,hashtag_count,brand_mentions,brand_count,content_type,total_engagement,engagement_rate,viral_score,quality_score,performance_bucket
2,Pepsi Connector,youtube,Pensi,2026-06-01 16:47:48.651571,UmV2Noqx05M,Pencilmate Can&#39;t Remember his Password! -in- PENCILMATRIX - Pencilmation Cartoons,0:00 - PENCILMATRIX Pencilmate is stuck in the Password Matrix. More crazy META situations here : 2:47 - A MIDSUMMER ...,https://www.youtube.com/watch?v=UmV2Noqx05M,UCUAL--p3qAa27luR0IYbjZA,Pencilmation,2018-10-09T11:00:02Z,47400017,218729,0,5417,https://i.ytimg.com/vi/UmV2Noqx05M/hqdefault.jpg,Pencilmate Can&#39;t Remember his Password! -in- PENCILMATRIX - Pencilmation Cartoons,10,85,0:00 - PENCILMATRIX Pencilmate is stuck in the Password Matrix. More crazy META situations here : 2:47 - A MIDSUMMER ...,21,120,0.0,Neutral,2795,67103.05,47400017,218729,0,5417,39,1,,0,Video,224146,0.4729,100,70,Viral
2,Pepsi Connector,youtube,Pensi,2026-06-01 16:47:48.651571,s5avCJ9MMoA,SkinnyIndonesian24 - PENSI - Pentas Swara Indonesia,SkinnyIndonesian24 (Andovi da Lopez & Jovial da Lopez) mengajak semua orang untuk keliling Indonesia. #PenSI24 ...,https://www.youtube.com/watch?v=s5avCJ9MMoA,UCUTc6457VhzHj-Bt2ejm2BA,skinnyindonesian24,2021-06-14T12:45:13Z,4851685,514722,0,53855,https://i.ytimg.com/vi/s5avCJ9MMoA/hqdefault.jpg,SkinnyIndonesian24 - PENSI - Pentas Swara Indonesia,7,51,SkinnyIndonesian24 (Andovi da Lopez & Jovial da Lopez) mengajak semua orang untuk keliling Indonesia. #PenSI24 ...,16,114,0.0,Neutral,1816,43605.29,4851685,514722,0,53855,PenSI24,1,,0,Video,568577,11.7192,100,60,Viral
2,Pepsi Connector,youtube,Pensi,2026-06-01 16:47:48.651571,F85zvsKMsjo,Pencilmate Loses his Shirt! -in- WELL OFF - Pencilmation Cartoons,0:00 - WELL OFF - Pencilmate finds a wishing well! Share YOUR fan art in our FB group here!,https://www.youtube.com/watch?v=F85zvsKMsjo,UCUAL--p3qAa27luR0IYbjZA,Pencilmation,2018-04-27T17:00:01Z,148287282,672833,0,11700,https://i.ytimg.com/vi/F85zvsKMsjo/hqdefault.jpg,Pencilmate Loses his Shirt! -in- WELL OFF - Pencilmation Cartoons,10,65,0:00 - WELL OFF - Pencilmate finds a wishing well! Share YOUR fan art in our FB group here!,19,91,-0.375,Negative,2960,71057.05,148287282,672833,0,11700,,0,,0,Video,684533,0.4616,100,25,Viral
2,Pepsi Connector,youtube,Pensi,2026-06-01 16:47:48.651571,SlWllgL_qME,NANG KANGJINSO PENSI OFFICIAL | JIREH UNITED | FEAT. SARLONGKI BEH ,Ne kechok keme pen jongsi nang pun Ledamde neke achak apun Arjapvek nangji kangsai la nanglidung Ne kangthir ne-ot pen ...,https://www.youtube.com/watch?v=SlWllgL_qME,UCJ1qWolFuAvQleRzQi66vSw,Jireh United,2026-04-28T20:05:26Z,48853,2819,0,189,https://i.ytimg.com/vi/SlWllgL_qME/hqdefault.jpg,NANG KANGJINSO PENSI OFFICIAL | JIREH UNITED | FEAT. SARLONGKI BEH,11,66,Ne kechok keme pen jongsi nang pun Ledamde neke achak apun Arjapvek nangji kangsai la nanglidung Ne kangthir ne-ot pen ...,21,122,0.0,Neutral,37,901.96,48853,2819,0,189,,0,,0,Video,3008,6.1572,50,65,Medium
2,Pepsi Connector,youtube,Pensi,2026-06-01 16:47:48.651571,kukhCPHNDEY,"Ecco i coltelli che puoi portare e quali no, cosa pensi di questa legge? #mondocoltelli",,https://www.youtube.com/watch?v=kukhCPHNDEY,UCNAVpLaGg4vuXbr9jNI1F8g,Mondo Coltelli,2026-05-28T12:00:10Z,52374,691,0,50,https://i.ytimg.com/vi/kukhCPHNDEY/hqdefault.jpg,"Ecco i coltelli che puoi portare e quali no, cosa pensi di questa legge? #mondocoltelli",15,87,,0,0,0.0,Neutral,7,190.05,52374,691,0,50,mondocoltelli,1,,0,Video,741,1.4148,15,60,Low
2,Pepsi Connector,youtube,Pensi,2026-06-01 16:47:48.651571,um79TbOXT4M,Tampil di Pensi Ada yang Panik | Besties,"Pensi dimulai, Elsa menjalankan rencana dan siasat jahatnya mencelakai Alea tapi semuanya gagal. ===== Royalty Free Music ...",https://www.youtube.com/watch?v=um79TbOXT4M,UCCmNN9sUF_uxhMDySf1OqQg,QueenDhi,2026-05-29T04:19:00Z,53377,2457,0,248,https://i.ytimg.com/vi/um79TbOXT4M/hqdefault.jpg,Tampil di Pensi Ada yang Panik | Besties,8,40,"Pensi dimulai, Elsa menjalankan rencana dan siasat jahatnya mencelakai Alea tapi semuanya gagal. ===== Royalty Free Music ...",18,125,0.0,Neutral,7,173.73,53377,2457,0,248,,0,,0,Video,2705,5.0677,50,40,Medium
2,Pepsi Connector,youtube,Pensi,2026-06-01 16:47:48.651571,QBEnbMa-mF0,NANG KANGJINSO PENSI / KAROKE WITH LYRICS / KARBI GOSPEL SONG,karoke available on Polson Kathar YT channel do subscribe for more.,https://www.youtube.com/watch?v=QBEnbMa-mF0,UCWKkEG8WVyanjJjDbK36o_w,Polson kathar,2026-05-09T17:09:34Z,2984,93,0,1,https://i.ytimg.com/vi/QBEnbMa-mF0/hqdefault.jpg,NANG KANGJINSO PENSI / KAROKE WITH LYRICS / KARBI GOSPEL SONG,11,61,karoke available on Polson Kathar YT channel do subscribe for more.,11,67,0.0,Neutral,26,640.89,2984,93,0,1,,0,,0,Video,94,3.1501,0,40,Low
2,Pepsi Connector,youtube,Pensi,2026-06-01 16:47:48.651571,Ed7qESeGN7A,Kanghon pensi Karbi Filme song from MUNJIN,My handsome actor brother Humbor.,https://www.youtube.com/watch?v=Ed7qESeGN7A,UCXZ3f146_GdCp2_8K3RZXKg,mangal rongphar,2009-05-27T08:26:30Z,654716,3254,0,164,https://i.ytimg.com/vi/Ed7qESeGN7A/hqdefault.jpg,Kanghon pensi Karbi Filme song from MUNJIN,7,42,My handsome actor brother Humbor.,5,33,0.0,Neutral,6218,149233.61,654716,3254,0,164,,0,,0,Video,3418,0.5221,60,25,High
2,Pepsi Connector,youtube,Pensi,2026-06-01 16:47:48.651571,IRo8EaL1oUc,pensi bussid,,https://www.youtube.com/watch?v=IRo8EaL1oUc,UCqSe6awG432itJBAlRy7Llg,utara the pulcra style ,2026-06-01T05:41:07Z,1324,26,0,1,https://i.ytimg.com/vi/IRo8EaL1oUc/hqdefault.jpg,pensi bussid,2,12,,0,0,0.0,Neutral,4,100.36,1324,26,0,1,,0,,0,Video,27,2.0393,0,15,Low
2,Pepsi Connector,youtube,Pensi,2026-06-01 16:47:48.651571,zvjbw9AL4UA,Il Giappone NON ci mancherà per quello che pensi,,https://www.youtube.com/watch?v=zvjbw9AL4UA,UCH3tGEnOnx6ql48zZTSiFvw,vandipety,2026-06-01T05:00:04Z,1572,103,0,13,https://i.ytimg.com/vi/zvjbw9AL4UA/hqdefault.jpg,Il Giappone NON ci mancherà per quello che pensi,9,48,,0,0,0.0,Neutral,4,101.05,1572,103,0,13,,0,,0,Video,116,7.3791,0,40,Low
2,Pepsi Connector,youtube,Pensi,2026-06-01 16:47:48.651571,P_BVrpm6bT4,A Cosa Pensi,Provided to YouTube by Ricordi A Cosa Pensi · Marco Masini Marco Masini ℗ 1990 SONY BMG MUSIC ENTERTAINMENT (Italy) ...,https://www.youtube.com/watch?v=P_BVrpm6bT4,UCeN29g94G5yPdqivVYAFfHw,Marco Masini - Topic,2015-01-21T14:18:40Z,90810,721,0,3,https://i.ytimg.com/vi/P_BVrpm6bT4/hqdefault.jpg,A Cosa Pensi,3,12,Provided to YouTube by Ricordi A Cosa Pensi · Marco Masini Marco Masini ℗ 1990 SONY BMG MUSIC ENTERTAINMENT (Italy) ...,21,119,0.0,Neutral,4152,99667.74,90810,721,0,3,,0,,0,Video,724,0.7973,15,25,Low
2,Pepsi Connector,youtube,Pensi,2026-06-01 16:47:48.651571,g8XyvwtC9CU,Yanti sedih banget denger bang rdw tiba tiba mau pensi #freefire #viralvideo,,https://www.youtube.com/watch?v=g8XyvwtC9CU,UCPwd1t4NQE4KKB55K2xSj7Q,YANTI CANTIKK,2026-05-31T05:52:59Z,448360,36595,0,2573,https://i.ytimg.com/vi/g8XyvwtC9CU/hqdefault.jpg,Yanti sedih banget denger bang rdw tiba tiba mau pensi #freefire #viralvideo,12,76,,0,0,0.0,Neutral,5,124.16,448360,36595,0,2573,"freefire,viralvideo",2,,0,Video,39168,8.7358,85,60,Viral
2,Pepsi Connector,youtube,Pensi,2026-06-01 16:47:48.651571,s13IPwNJJXM,Pensi La Top Rangdum Ladakh,,https://www.youtube.com/watch?v=s13IPwNJJXM,UCSY0XZz6NFkePE9C-MqSNQg,Sain TV,2023-03-24T07:23:04Z,708,27,0,0,https://i.ytimg.com/vi/s13IPwNJJXM/hqdefault.jpg,Pensi La Top Rangdum Ladakh,5,27,,0,0,0.5,Positive,1169,28058.66,708,27,0,0,,0,,0,Video,27,3.8136,0,15,Low
2,Pepsi Connector,youtube,Pensi,2026-06-01 16:47:48.651571,0icok4d9Y1o,Tu Non Sei Ciò che Pensi di Essere: Sei le Azioni che Compi,Vuoi Imparare a Meditare? Scarica Gratis Clarity: https://jo.my/clarity-app - Instagram: ...,https://www.youtube.com/watch?v=0icok4d9Y1o,UCsfXsaO28PnYOtwvEdpKKRg,Dr. Gennaro Romagnoli • PsiNel,2025-09-28T08:00:01Z,7330,629,0,23,https://i.ytimg.com/vi/0icok4d9Y1o/hqdefault.jpg,Tu Non Sei Ciò che Pensi di Essere: Sei le Azioni che Compi,13,59,Vuoi Imparare a Meditare? Scarica Gratis Clarity: https://jo.my/clarity-app - Instagram: ...,11,92,0.0,Neutral,250,6002.05,7330,629,0,23,,0,,0,Video,652,8.895,0,40,Low
2,Pepsi Connector,youtube,Pensi,2026-06-01 16:47:48.651571,s2IKXAwUsIk,👀 Think Before You Believe #ytshorts #motivation #reality #truth,,https://www.youtube.com/watch?v=s2IKXAwUsIk,UCelOyySQMezOEo5DfWk-0dw,DUBE-JEE (Ajju Sir Physics),2026-06-01T05:49:28Z,1323,0,0,15,https://i.ytimg.com/vi/s2IKXAwUsIk/hqdefault.jpg,👀 Think Before You Believe #ytshorts #motivation #reality #truth,9,64,,0,0,0.0,Neutral,4,100.22,1323,0,0,15,"truth,motivation,reality,ytshorts",4,,0,Short,15,1.1338,0,60,Low
2,Pepsi Connector,youtube,Pensi,2026-06-01 16:47:48.651571,HTFUreg6qpY,JINGLE PENSI TRANSTV - WE CAN DANCE,"Hai boys and girls.... It's time for ""WE CAN DANCE""!! PENSI menantang kalian untuk membuat koreografi yang unik dan keren ...",https://www.youtube.com/watch?v=HTFUreg6qpY,UCIohHXwCEKxWCLvAguJ-GjA,TRANS TV Official,2016-09-20T11:53:32Z,22657,146,0,16,https://i.ytimg.com/vi/HTFUreg6qpY/hqdefault.jpg,JINGLE PENSI TRANSTV - WE CAN DANCE,7,35,"Hai boys and girls.... It's time for ""WE CAN DANCE""!! PENSI menantang kalian untuk membuat koreografi yang unik dan keren ...",21,125,0.0,Neutral,3544,85078.16,22657,146,0,16,,0,,0,Video,162,0.715,15,50,Low
2,Pepsi Connector,youtube,Pensi,2026-06-01 16:47:48.651571,piCyt8Jhnds,Pensi La Lake | Ladakh | Zanskar Valley,Pensi La Lake.,https://www.youtube.com/watch?v=piCyt8Jhnds,UC9sZTxjm1Hc2uIX7QYpsSBA,awara traveler,2024-05-28T05:48:49Z,939,18,0,2,https://i.ytimg.com/vi/piCyt8Jhnds/hqdefault.jpg,Pensi La Lake | Ladakh | Zanskar Valley,8,39,Pensi La Lake.,3,14,0.0,Neutral,738,17716.23,939,18,0,2,,0,,0,Video,20,2.1299,0,40,Low
2,Pepsi Connector,youtube,Pensi,2026-06-01 16:47:48.651571,h3ueGdDAQQc,3 YOUTUBER FF YANG PENSI FF 😭 #shorts #freefire #bangisur,,https://www.youtube.com/watch?v=h3ueGdDAQQc,UCVklTljSqJz2Cez4_KfKCBQ,Bang iSur,2022-09-30T11:37:47Z,67371,5929,0,156,https://i.ytimg.com/vi/h3ueGdDAQQc/hqdefault.jpg,3 YOUTUBER FF YANG PENSI FF 😭 #shorts #freefire #bangisur,10,57,,0,0,0.0,Neutral,1343,32254.42,67371,5929,0,156,"shorts,bangisur,freefire",3,,0,Short,6085,9.0321,50,60,Medium
2,Pepsi Connector,youtube,Pensi,2026-06-01 16:47:48.651571,-0PmWPeEKY8,Ex EVOS WANN yakin pensi #evos #evoswannn #mobilelegends,,https://www.youtube.com/watch?v=-0PmWPeEKY8,UCR4Y86trv3k1WJiIR0w0Xdg,the rive,2025-01-31T06:00:00Z,90277,1195,0,43,https://i.ytimg.com/vi/-0PmWPeEKY8/hqdefault.jpg,Ex EVOS WANN yakin pensi #evos #evoswannn #mobilelegends,8,56,,0,0,0.0,Neutral,490,11764.05,90277,1195,0,43,"evos,evoswannn,mobilelegends",3,,0,Video,1238,1.3713,35,60,Medium
2,Pepsi Connector,youtube,Pensi,2026-06-01 16:47:48.651571,qTKydGNw26E,A Cosa Pensi,Provided to YouTube by Universal Music Group A Cosa Pensi · Milva E Dintorni ℗ 1982 Universal Music GmbH Released on: ...,https://www.youtube.com/watch?v=qTKydGNw26E,UCH1NtjaUPi0Yl0JkKhPSkBQ,Milva - Topic,2023-04-27T10:00:41Z,21676,241,0,0,https://i.ytimg.com/vi/qTKydGNw26E/hqdefault.jpg,A Cosa Pensi,3,12,Provided to YouTube by Universal Music Group A Cosa Pensi · Milva E Dintorni ℗ 1982 Universal Music GmbH Released on: ...,22,121,0.0,Neutral,1135,27240.04,21676,241,0,0,,0,,0,Video,241,1.1118,15,40,Low
